,Abbreviazione,Bibliografia,
331,Winckelmannsfeste 1872,"Chronik der Winckelmannsfeste, in AZ, 30, 1872, pp. 175-179. ",
332,Woburn Abbey 1822,"Outline engravings and descriptions of the Woburn Abbey marbles, London 1822.",
333,ZAHN 1828-1859,"W. Zahn, Die schönsten Ornamente und merkwürdigsten Gemälde aus Pompeji, Herculanum und Stabiae nebst einigen Grundrissen und Ansichten nach den an Ort und Stelle gemachten Originalzeichnungen, I-III, Berlin 1828-1859.",
334,ZVETAIEFF 1878,"I. Zvetaieff, Sylloge inscriptionvm oscarvm ad archetyporvm et librorvm fidem, I-II, Petropoli 1878.",
335,,,
336,,,
